B1: 男籃 | C1: 女籃 | D1: 男排 | E1: 女排 | F1: 羽球 | G1: 壘球 | H1: 足球 | I1: 桌球(團) | J1: 桌球(個) | K1: 撞球(個) | L1: 團體合計 | M1: 個人合計
A2: 國立臺灣大學 | B2: 2 | D2: 2 | E2: 1 | F2: 3 | G2: 1 | H2: 1 | I2: 4 | J2: 12 | L2: =SUM(B2:I2) -> 14 | M2: =SUM(J2:K2) -> 12
A3: 國立臺灣師範大學 | B3: 2 | C3: 2 | D3: 2 | E3: 1 | F3: 1 | G3: 1 | I3: 2 | J3: 6 | L3: =SUM(B3:I3) -> 11 | M3: =SUM(J3:K3) -> 6
A4: 國立中興大學 | B4: 1 | D4: 1 | E4: 1 | F4: 1 | G4: 2 | I4: 1 | J4: 1 | K4: 1 | L4: =SUM(B4:I4) -> 7 | M4: =SUM(J4:K4) -> 2
A5: 國立成功大學 | B5: 1 | D5: 1 | E5: 1 | F5: 1 | G5: 1 | H5: 1 | I5: 1 | J5: 3 | L5: =SUM(B5:I5) -> 7 | M5: =SUM(J5:K5) -> 3
A6: 東吳大學 | B6: 1